{
  "itemName": "Sony PlayStation Portable PSP-3000",
  "brandCharacterSeries": "Sony PlayStation Portable",
  "versionOrPeriod": "PSP-3000",
  "color": "black",
  "category": "Cards & Game Collectibles",
  "subtype": "retro_games",
  "productType": "game_hardware",
  "searchKeywordsJa": ["PSP-3000 中古", "PSP 3000 本体 中古", "プレイステーションポータブル 3000 中古"],
  "priceSearchKeywordJa": "PSP-3000 本体 中古",
  "recommendedAreas": [{
    "area": "秋葉原",
    "reason": "中古游戏机与复古游戏店较集中，适合寻找 PSP 系列商品。",
    "storeSearchKeywordJa": "秋葉原 中古 レトロゲーム 店舗"
  }],
  "storeRecommendationDisclaimer": "候选区域和店铺根据商品类别与通常经营范围推荐，不代表实时库存；请在出发前自行确认店铺状态。",
  "notes": []
}
